{
  "schema_version": 2,
  "engine": "0.12.0",
  "packs": [
    "universal.authoring",
    "language.rust"
  ],
  "releases": ".orly/rels",
  "commands": {
    "conform": {
      "argv": [
        "cargo",
        "--version"
      ],
      "resources": [
        "cargo"
      ]
    },
    "verify.unit": {
      "argv": [
        "cargo",
        "test",
        "--locked"
      ],
      "resources": [
        "cargo"
      ],
      "deadline_seconds": 1800
    }
  },
  "allowed_executables": [
    "cargo"
  ],
  "surfaces": {
    "user": [
      "src/main.rs"
    ],
    "docs": [
      "PROJECT_RULES.md"
    ]
  },
  "data_packs": [
    "project-pack.json"
  ]
}
